text; value
Tor Browser

PRIVACY POLICY
- What information we collect
- 1. Personal Information:
- We do NOT collect any Personal Information about you. “Personal Information” means personally identifiable information, such as your name, email address, physical address, calendar entries, contact entries, files, photos, etc.
- 2. Non-Personal Information:
- We collect non-personal information about your use of our Apps and aggregated information regarding the usages of the Apps. “Non-Personal Information” means information that is of an anonymous nature, such as the type of mobile device you use, your mobile devices unique device ID, the IP address of your mobile device, your mobile operating system, the list of system applications and currently installed applications, and information about the way you use the Applications.
- 3. Location Services:
- We do NOT request, collect, or access your location information.


THIRD PARTY APPS / LINKS
- Inside our apps or services we display ads / links to other companies or mobile applications.
When you click on ads / links of third parties in our apps or services, you may leave the app or service. 
We do not responsible for the privacy practices adopted by third parties.We recommend that you read their privacy policies. ;NaN


SECURITY
- We are very concerned about safeguarding the confidentiality of your information.
We do not collect Personal Information, and we employ administrative, physical and electronic measures designed to protect your Non-Personal
Information from unauthorized access and use. ;1


Your Privacy
- We do not store or retain any personal information that can be used to identify you (the end user), unless specifically stated in the application
(for example, an e-mail address used for account registration).
No data specific to the end user will be shared or sold to third parties. ;1

We have no interest in housing and storing users personal information or data.;1


CONTACT
- If you have any questions or comments about this Privacy Policy, or any other issues regarding our apps or services,
Mail at contact.approsoftllc@gmail.com ;6







DuckDuckGo

DuckDuckGo does not collect or share personal information. That is our privacy policy in a nutshell.
The rest of this page tries to explain why you should care

WHY YOU SHOULD CARE
________________________________________
SEARCH LEAKAGE  

At other search engines, when you do a search and then click on a link, your search terms are sent to that site you clicked on (in the HTTP referrer header).
We call this sharing of personal information "search leakage."
For example, when you search for something private, you are sharing that private search not only with your search engine, 
but also with all the sites that you clicked on (for that search). ;NaN

In addition, when you visit any site, your computer automatically sends information about it to that site (including your User agent and IP address). 
This information can often be used to identify you directly.
So when you do that private search, not only can those other sites know your search terms, but they can also know that you searched it.
It is this combination of available information about you that raises privacy concerns. ;NaN

DuckDuckGo prevents search leakage by default. Instead, when you click on a link on our site, we route (redirect) that request in such a way so that it does not send your search terms to other sites.
The other sites will still know that you visited them, but they will not know what search you entered beforehand.
At some other search engines (including us), you can also use an encrypted version (HTTPS), which as a byproduct doesn't usually send your search terms to sites.
However, it is slower to connect to these versions and if you click on a site that also uses HTTPS then your search is sent. Nevertheless, the encrypted version
does protect your search from being leaked onto the computers it travels on between you and us. ;NaN

At DuckDuckGo, our encrypted version goes even further and automatically changes links from a number of major Web sites to point to the encrypted versions of those sites. 
It is modeled after (and uses code from) the HTTPS Everywhere FireFox add-on. These sites include Wikipedia, Facebook, Twitter, and Amazon to name a few.
Another way to prevent search leakage is by using something called a POST request, which has the effect of not showing your search in your browser, and, as a consequence, does not send it to other sites. 
You can turn on POST requests on our settings page, but it has its own issues. POST requests usually break browser back buttons, and they make it impossible for you to easily share your search by copying and pasting it out of your Web browser's address bar.
Finally, if you want to prevent sites from knowing you visited them at all, you can use a proxy like Tor. DuckDuckGo actually operates a Tor exit enclave, which means you can get end to end anonymous and encrypted searching using Tor & DDG together.
You can enter !proxy domain into DuckDuckGo as well, and we will route you through a proxy, e.g. !proxy breadpig.com. This feature is part of our !bang syntax. 
Unfortunately, proxies can also be slow, and free proxies (like the one we use) are funded by arguably excessive advertising. ;NaN

Because of these drawbacks in HTTPS, POST and proxies we decided to take the redirect approach to combat search leakage. 
However, we leave the choice up to you. You can deviate from the default on our settings page by toggling the redirect or address bar settings. 
You can also use our encrypted version. ;NaN

SEARCH HISTORY  
Other search engines save your search history. Usually your searches are saved along with the date and time of the search, 
some information about your computer (e.g. your IP address, User agent and often a unique identifier stored in a browser cookie), 
and if you are logged in, your account information (e.g. name and email address).
With only the timestamp and computer information, your searches can often be traced directly to you. With the additional account information, they are associated directly with you.
Also, note that with this information your searches can be tied together. This means someone can see everything you've been searching, not just one isolated search. 
You can usually find out a lot about a person from their search history.
It's sort of creepy that people at search engines can see all this info about you, but that is not the main concern. ;NaN 

The main concern is when they either a) release it to the public or b) give it to law enforcement.
Why would they release it to the public? AOL famously released supposedly anonymous search terms for research purposes, 
except they didn't do a good job of making them completely anonymous, and they were ultimately sued over it. 
In fact, almost every attempt to anonymize data has similarly been later found out to be much less anonymous than initially thought.
The other way to release it to the public is by accident. Search engines could lose data, or get hacked, or accidentally expose data due to security holes or incompetence, all of which has happened with personal information on the Internet.
Why would search engines give your search history to law enforcement? Simply because law enforcement asked for it, usually as part of a legal investigation. If you read privacy policies and terms of service carefully you will notice that they say they can give your information on court order.
This makes sense because they may be legally obligated to do so. However, search engines are not legally obligated to collect personal information in the first place. They do it on their own volition.
The bottom line is if search engines have your information, it could get out, even if they have the best intentions. And this information (your search history) can be pretty personal.
For these reasons, DuckDuckGo takes the approach to not collect any personal information. The decisions of whether and how to comply with law enforcement requests, whether and how to anonymize data, and how to best protect your information from hackers are out of our hands. Your search history is safe with us because it cannot be tied to you in any way.
INFORMATION
________________________________________
INFORMATION NOT COLLECTED 
When you search at DuckDuckGo, we don't know who you are and there is no way to tie your searches together.
When you access DuckDuckGo (or any Web site), your Web browser automatically sends information about your computer, e.g. your User agent and IP address.
Because this information could be used to link you to your searches, we do not log (store) it at all. ;5

This is a very unusual practice, but we feel it is an important step to protect your privacy.
It is unusual for a few reasons. First, most server software auto-stores this information, so you have to go out of your way not to store it. 
Second, most businesses want to keep as much information as possible because they don't know when it will be useful. 
Third, many search engines actively use this information, for example to show you more targeted advertising.
Another way that your searches are often tied together at other search engines are through browser cookies, which are pieces of 
information that sit on your computer and get sent to the search engine on each request. ;NaN

What search engines often do is store a unique identifier in your browser and then associate that identifier with your searches. At DuckDuckGo, no cookies are used by default.
In response to efforts by the EFF and others, the major search engines have begun "anonymizing" their search log data after periods of time. Sure, this is better than not doing so, but you should note that this does not make your search history anonymous in the same way that it is at DuckDuckGo.
What search engines generally do when they anonymize data is get rid of part of your IP address or turn it into something that doesn't look 
exactly like an IP address. And they do the same thing for uniquely identifying cookies.
However, in many cases, this so-called anonymous data can still tie your searches together, which can be used to reconstruct 
who you are and what you searched for. Additionally, search engines usually are silent on what they do with the User agent, 
which has been shown to also have enough information to often be personally identifiable, especially if isolated to a particular search session (day).;NaN

INFORMATION COLLECTED  
At DuckDuckGo, no cookies are used by default. If you have changed any settings, then cookies are used to store those changes. 
However, in that case, they are not stored in a personally identifiable way. For example, the large size setting is stored as 's=l'; no unique identifier is in there. Furthermore, if you prefer not to use cookies to store settings, you can use URL parameters instead.
Additionally, if you use our !bang syntax/dropdown, which bangs you use are stored in a cookie so that we can list your most frequently used 
ones on top of the !bang dropdown box. Just like the other settings, this information is not saved on our servers at all, but resides solely 
on your computer. There is also a setting to turn this off, which you can also set via a URL parameter. Particular searches are of course not stored.;1 ;5
 
An example cookie might look like: php=2&yelp=19&java=4.
We also save searches, but again, not in a personally identifiable way, as we do not store IP addresses or unique User agent strings. 
We use aggregate, non-personal search data to improve things like misspellings.
Similarly, we may add an affiliate code to some eCommerce sites (e.g. Amazon & eBay) that results in small commissions being paid back to DuckDuckGo when you make purchases at those sites. We do not use any third parties to do the code insertion, and we do not work with any sites that share personally identifiable information (e.g. name, address, etc.) via their affiliate programs. This means that no information is shared from DuckDuckGo to the sites, and the only information that is collected from this process is product information, which is not tied to any particular user and which we do not save or store on our end. It is completely analogous to the search result case from the previous paragraph--we can see anonymous product info such that we cannot tie them to any particular person (or even tie multiple purchases together). This whole affiliate process is an attempt to keep advertising to a minimal level on DuckDuckGo.
Finally, if you give us feedback, it may be stored in our email. 
However, you can give anonymous feedback (by not entering your email or other personal info on the feedback form). ;NaN

INFORMATION SHARED 
If you turn redirects off in the settings and you don't either turn POST on or use our encrypted site, 
then your search could leak to sites you click on. 
Yet as explained above, this does not happen by default.
Also, like anyone else, we will comply with court ordered legal requests. 
However, in our case, we don't expect any because there is nothing useful to give them since we don't collect any personal information. ;NaN

OTHER
________________________________________
OTHER SEARCH ENGINES  [TOP]
If you care about search privacy, you might also want to check out these other search engines that take it seriously by default.
•	Ixquick [privacy policy]
Each does things a bit differently in terms of privacy and very differently in terms of results. And not all go as far as DuckDuckGo in some aspects. However, none store your personal information by default, which make them all pretty safe in our opinion.
UPDATES  [TOP]
If this policy is substantively updated, we will update the text of this page and provide notice to you at https://duckduckgo.com/about by writing '(Updated)' in red next to the link to this page (in the footer) for a period of at least 30 days.
FEEDBACK  [TOP]
I (Gabriel Weinberg) am the founder of Duck Duck Go and personally wrote this privacy policy. If you have any questions or concerns, please submit feedback.
Add DuckDuckGo to Chrome ;NaN




Winscp

What information do we collect?

We can collect information from you when you visit our site, install or use WinSCP application. People have different privacy concerns. 
Our goal is to be clear about what information we collect, so that you can make meaningful choices about how it is used.
Visiting winscp.net
When registering on our site, as appropriate, you may be asked to enter your: name, e-mail address or location. You may, however, visit our site 
anonymously.
After donating to WinSCP, as appropriate, you may be asked to enter your: name, e-mail address, mailing address or donation entry details.
Third party vendors, including Google, use cookies to serve ads on our site. Google’s use of the DART cookie enables it to serve ads to our 
users based on their visit to our site and other sites on the Internet. Users may opt-out of the use of the DART cookies by visiting the Google 
ad and content network Privacy policy. Users may opt out of DoubleClick’s use of cookies by visiting the DoubleClick opt-out page.
Installing WinSCP application ;NaN

When installing WinSCP, we might collect anonymous information about the number of initiated and finished installations per geo-location and language. 
No private information is collected. WinSCP installer might offer you to install a third party application along with WinSCP, in such a case we collect also statistics for its installations. Note that before deciding to install any third party application, you are required to agree to its separate and independent Terms of use and Privacy policy.
Using WinSCP application
When using WinSCP application, we might collect anonymous WinSCP usage statistics. You may, however, opt-out from providing WinSCP usage statistics 
or from WinSCP automatic check for application updates. ;NaN

Advertisement
What do we use your information for?
Any of the information we collect from you may be used in one of the following ways:
•	To personalize your experience (your information helps us to better respond to your individual needs)
•	To improve our website and our application (we continually strive to improve our offerings based on the information and feedback we receive from you)
•	To process transactions (your information, whether public or private, will not be sold, exchanged, transferred, or given to any other company 
for any reason whatsoever, without your consent, other than for the express purpose of delivering the purchased product or service requested.) ;1

•	To administer a contest, promotion, survey or other site feature ;NaN

How do we protect your information?
We use PayPal to process your payments. PayPal offers the use of a secure server. All supplied sensitive information is transmitted via 
Transport Layer Security (TLS) or Secure Socket Layer (SSL) technology and then encrypted into our Payment gateway providers database only to be accessible by those authorized with special access rights to such systems, and are required to keep the information confidential. Please refer also to PayPal Privacy policy for details.
After a transaction, your private information (credit cards, social security numbers, etc.) will not be stored on our servers. ;NaN

Do we use cookies?
Yes, on winscp.net we use cookies. Cookies are small files that a site or its service provider transfers to your computers hard drive through your 
Web browser (if you allow) that enable the sites or service providers systems to recognize your browser and capture and remember certain information.
We use cookies to compile aggregate data about site traffic and site interaction so that we can offer better site experiences and tools in the future.
Note that you can change your browser settings to disable cookies if you have privacy concerns. ;NaN

Do we disclose any information to outside parties?
We do not sell, trade, or otherwise transfer to outside parties your personally identifiable information. This does not include trusted 

third parties who assist us in operating our website, conducting our business, or servicing you, so long as those parties agree to keep this information 
confidential. We may also release your information when we believe release is appropriate to comply with the law, enforce our site policies, or protect 
ours or others rights, property, or safety. ;1

However, non-personally identifiable visitor information may be provided to other parties for marketing, 
advertising, or other uses. ;2

Third party links
Occasionally, at our discretion, we may include or offer third party products or services on our website. These third party sites have separate and 
independent privacy policies. We therefore have no responsibility or liability for the content and activities of these linked sites. 
Nonetheless, we seek to protect the integrity of our site and welcome any feedback about these sites. ;NaN 


Advertisement
California online privacy protection act compliance
Because we value your privacy we have taken the necessary precautions to be in compliance with the California Online Privacy Protection Act. 
We therefore will not distribute your personal information to outside parties without your consent. ;1

All registered users of our site may make any changes to their information at anytime by logging into the forum and going to the Profile page.; NaN

Your consent
By using our site or installing or using WinSCP, you consent to our Privacy policy.
Warrant canary
We have not placed any backdoors into our software and have not received any requests for doing so. 
Pay close attention to any modifications to the previous sentence.
Learn about Warrant canary.
Changes to our Privacy policy
If we decide to change our Privacy policy, we will post those changes on this page, and update the Privacy policy modification date below.
This policy was last modified on 2015-11-15.
— WinSCP team
This policy is based on Free Privacy Policy Generator
;7



Fruit Ninja

Privacy Policy
Effective Date: January 24, 2019 
At FruitNinja.io (“Fruit Ninja”, “we,” “us,” or “our”), we understand the importance of maintaining your privacy, and we, therefore, 
strive to provide our service with your protection in mind. This Privacy Policy applies to your use of our service whether accessed via computer 
or mobile device (the “Service”) on our owned and operated websites, mobile applications, and other properties on which a link to this Privacy Policy 
is provided (collectively, “Fruit Ninja”). This Policy does not apply to third-party properties that contain other privacy policies. ;NaN

If you have any questions regarding this Privacy Policy, please at support at Fruit Ninja@gmail.com ;7

YOUR ACCEPTANCE 
In accessing the Service and/or the Fruit Ninja Web Pages, you accept all the terms and conditions of this Privacy Policy. Accordingly, 
we ask that you bookmark and periodically review this Privacy Policy to ensure continuing familiarity with the most current version. 
If you do not agree with the terms and conditions of this Privacy Policy, we request that you immediately cease using and accessing the Service 
and/or the Fruit Ninja Web Pages. ;NaN

INFORMATION WE COLLECT 
Fruit Ninja collects information from you in two ways: information you give to us, and information that we gather from your use of our Service, 
collectively known as “Personally Identifiable Information” or “PII”. PII, as described in US privacy law and information security, is information 
that can be used on its own or with other information to identify, contact, or locate a single person, or to identify an individual in context. ;NaN
 
Such information is made up of “Personal Information” and “Non-Personal Information.”
“Personal Information” means information that you provide to us that personally identifies you, such as your first and last name, email address, 
physical address, telephone number, billing information, or social security number.
“Non-Personal Information” means information that does not specifically identify you. ;NaN

The information you give to us. 
We collect information that you give to us. For example, as part of our Service, you may elect to provide us with your email address or other 
information to receive newsletters and other notifications about certain features of our Service. Such registration may include your disclosure 
to us of Personal Information.
Information we gather from your use of our Service. 
We, like many websites and applications, collect information about what parts of our Service you use and how you use them. Information we may gather 
includes, but is not limited to:
•	Computer or browser information such as your system activity, the domain name of the web site from which you linked to our Service and/or the 
Fruit Ninja Web Pages, the time and duration of your use of our Service and any queries, browser type, and browser language.
•	Device information such as your hardware model, operating system, operating system version, mobile device type, unique identifiers from your 
computer or mobile device, application download information, and/or IP address.
•	Location information such as your geolocation when you use our Service from a mobile device and/or mobile application. We may ask for you to 
manually provide precise location information or to enable your mobile device to send us precise location information.
;NaN
We may use unique identifiers, Flash cookies, web beacons, web server log information, or other technologies to collect information about you. 
In addition to the information that we collect from you for our own Service, we may collect information from you for third parties for purposes such 
as ad targeting, optimization, and reporting. ;2 ;4

OUR INFORMATION USE 
We collect information from you and our other users to administer our business activities and to measure and improve our Service. 
In addition, information collected from end-users may be used in aggregate form to, among other things, determine the total number 
of end-users who are using our Service, diagnose and fix compatibility problems or other problems with our Service, and perform statistical analyses 
to enable us to build higher quality, more useful online services and content. ;NaN
 
We may use the information collected from you to show advertising and 
promotions tailored to your interests. If you submit a request for information about Fruit Ninja through our web site, we may use your e-mail address to 
assist you with any issues you may have or to send you an e-mail that gives you the opportunity to elect to receive periodic e-mail alerts from Fruit Ninja 
regarding developments at the company. In addition, if you elect to receive promotional information from Fruit Ninja by registering for our newsletter 
and other notifications, we will use the information you provided to Fruit Ninja to send you only promotions that will be most relevant to you.
We may also use your e-mail address to send you important notices. Because this information is important to your use of our Service, 
you may not opt out of receiving these communications. ;NaN

We may combine your Personal Information that we have with other information that we obtain from business partners or other companies. 
We may also combine your Personal Information with Non-Personal Information. If we do so, the combined information will be treated as
Personal Information for as long as it remains combined. ;NaN

INFORMATION SHARING AND DISCLOSURE 
In providing our Service to you, we may find it necessary or beneficial to share your information with our partners, including our advertising, 
services and content partners (collectively, “Partners”) or allow such Partners to gather information directly from you.
